{
  "$schema": "../../../schemas/monado-enterprise/v2/index.schema.json",
  "schemaVersion": "2.0.0",
  "contractId": "monado-enterprise-experience-fabric-v2",
  "status": "authoritative",
  "historicalInputs": [
    "config/storage/monadoblade-partitions.2x2tb.v1.json",
    "config/storage/monadoblade-folder-hierarchy.v1.json",
    "config/profiles/monadoblade-profiles.v1.json",
    "config/software/monadoblade-profile-software.v1.json",
    "config/gui/monado-profile-shell.v1.json",
    "config/aihub/profile-optimization-policies.v1.json"
  ],
  "executionMode": "proposal-only",
  "destructiveApplyDefault": false,
  "requiresApprovalEvidence": true,
  "contracts": {
    "storage": "config/monado-enterprise/v2/storage.contract.v2.json",
    "profiles": "config/monado-enterprise/v2/profiles.contract.v2.json",
    "experience": "config/monado-enterprise/v2/experience.contract.v2.json",
    "synchronization": "config/monado-enterprise/v2/synchronization.contract.v2.json",
    "repositoryMap": "config/monado-enterprise/v2/repository-map.contract.v2.json"
  },
  "profileManifestDirectory": "config/monado-enterprise/v2/profile-manifests",
  "profileManifestSchema": "schemas/monado-enterprise/v2/profile-manifest.v2.xsd",
  "relatedIssues": [
    149,
    171,
    172,
    195,
    198,
    203,
    204,
    206
  ],
  "blockedPathsFromDraftPr205": [
    ".github/workflows/hermes-xcore-contract.yml",
    "contracts/hermes-xcore/v1/event.schema.json",
    "contracts/hermes-xcore/v1/system.contract.json",
    "docs/architecture/HERMES_XCORE_SOURCE_IMPORT_DISPOSITION_2026-07-28.md",
    "docs/architecture/HERMES_XCORE_UNIFIED_SPEC_V1.md",
    "tests/contracts/test_hermes_xcore_contract.py"
  ]
}
